{
  "version": "1.0.0",
  "group": "olivia-ecosystem",
  "default_policy": {
    "mode": "deny-by-default",
    "require_confirmation_for": []
  },
  "agents": {
    "Olivia Orchestrator Control Panel": {
      "allowed_tools": [
        "add_authority_stub_tool",
        "add_element_grid_tool",
        "attach_confidence_tool",
        "build_evidence_layer_tool",
        "build_manifest_tool",
        "build_nexus_layer_tool",
        "build_norms_layer_tool",
        "copy_source_into_bundle_tool",
        "derive_confidence_tool",
        "embed_dev_code",
        "embed_project_uploads",
        "embed_uploads_global",
        "embedder_info_tool",
        "enrich_stage_tool",
        "enrich_violation_tool",
        "files_delete",
        "files_get_content",
        "files_list",
        "files_list_laws",
        "files_list_transcripts",
        "files_read",
        "files_summarize",
        "files_upload",
        "files_upload_law",
        "files_upload_transcript",
        "framework_ingest_tool",
        "garage_add_thread_message",
        "garage_assign_tool_to_assistant",
        "garage_assistant_chat",
        "garage_assistant_deepseek",
        "garage_attach_file_to_assistant",
        "garage_attach_file_to_thread",
        "garage_chat_completions",
        "garage_clear_knowledge_collection",
        "garage_create_assistant",
        "garage_create_thread",
        "garage_create_thread_run",
        "garage_create_tool",
        "garage_deep_reasoning",
        "garage_deepseek_engineer_chat",
        "garage_deepseek_stream_proxy",
        "garage_delete_assistant",
        "garage_delete_thread",
        "garage_delete_tool",
        "garage_detach_file_from_assistant",
        "garage_execute_tool",
        "garage_execute_tool_by_name",
        "garage_get_assistant",
        "garage_get_knowledge_collection_stats",
        "garage_get_thread",
        "garage_get_tool",
        "garage_health",
        "garage_ingest_knowledge_file",
        "garage_ingest_knowledge_text",
        "garage_list_assistant_files",
        "garage_list_assistants",
        "garage_list_files",
        "garage_list_models",
        "garage_list_thread_messages",
        "garage_list_threads",
        "garage_list_tools",
        "garage_query_assistant_knowledge",
        "garage_query_assistant_knowledge_collections",
        "garage_query_knowledge",
        "garage_replace_assistant",
        "garage_update_assistant",
        "ingestion_batch_ingest",
        "ingestion_collection_info",
        "ingestion_collection_stats",
        "ingestion_delete_collection",
        "ingestion_ingest_directory",
        "ingestion_ingest_files",
        "ingestion_legal_ingest",
        "ingestion_legal_v2_ingest",
        "ingestion_list_collections",
        "ingestion_search",
        "ingestion_status",
        "ingestion_transcript_ingest",
        "init_violation",
        "juris_chat",
        "juris_citations",
        "juris_docx_index",
        "juris_docx_rebuild",
        "juris_download",
        "juris_download_batch",
        "juris_download_status",
        "juris_flat_corpus_stats",
        "juris_health",
        "juris_json_index",
        "juris_json_rebuild",
        "juris_legal_framework_search",
        "juris_legal_framework_stats",
        "juris_master_index_document",
        "juris_master_index_documents",
        "juris_master_index_markdown",
        "juris_master_index_rebuild",
        "juris_master_index_search",
        "juris_master_index_stats",
        "juris_master_index_summary",
        "juris_relator_network",
        "juris_results",
        "juris_search_history",
        "juris_search_history_file",
        "juris_search_start",
        "juris_search_status",
        "juris_set_base_url",
        "juris_start_service",
        "juris_stats",
        "juris_stop_service",
        "juris_storage_paths",
        "juris_storage_rebuild",
        "juris_upload_file",
        "jurisprudence_ingest_tool",
        "jurisprudence_search_tool",
        "jurisprudence_verify_tool",
        "llm_provider_info_tool",
        "neo4j_find_violations_citing_tool",
        "neo4j_find_violations_with_contested_element_tool",
        "neo4j_reset_database_tool",
        "neo4j_upsert_violation_tool",
        "neo4j_walk_implications_tool",
        "ocr_compare_results",
        "ocr_list_images",
        "ocr_list_output_artifacts",
        "ocr_process_image",
        "ocr_run_batch",
        "pdf_analyze_pdf",
        "pdf_apply_renaming_plan",
        "pdf_convert_analysis_directory_to_csv",
        "pdf_extract_text",
        "pdf_generate_renaming_plan_from_csv",
        "pdf_run_pipeline",
        "pdf_scan_files",
        "prompt_analyze",
        "prompt_evaluate",
        "prompt_examples",
        "prompt_generate",
        "prompt_improve",
        "prompt_optimize",
        "prompt_variations",
        "qdrant_collection_summary",
        "qdrant_connect",
        "qdrant_create_collection",
        "qdrant_delete_collection",
        "qdrant_embed_case_directory",
        "qdrant_ensure_legal_indexes",
        "qdrant_index_reviewed_transcript",
        "qdrant_index_violation_tool",
        "qdrant_ingest_directory",
        "qdrant_ingest_file",
        "qdrant_list_collections",
        "qdrant_query",
        "qdrant_query_vector",
        "qdrant_reset_collections_tool",
        "qdrant_search",
        "qdrant_search_articles_tool",
        "qdrant_search_authorities_tool",
        "qdrant_search_jurisprudence_tool",
        "qdrant_search_legacy",
        "qdrant_search_segments_tool",
        "qdrant_structured_ingest",
        "qdrant_upsert_jurisprudence_tool",
        "refine_batch_tool",
        "run_pipeline_tool",
        "transcript_ingest_tool",
        "transcription_audio_info",
        "transcription_cancel_job",
        "transcription_diarize",
        "transcription_extract_features",
        "transcription_get_status",
        "transcription_healthcheck",
        "transcription_list_asr_bundles",
        "transcription_list_models",
        "transcription_list_project_paths",
        "transcription_resample_audio",
        "transcription_segment_speakers",
        "transcription_sentiment",
        "transcription_slice_audio",
        "transcription_speaker_id",
        "transcription_summarize",
        "transcription_transcribe_audio",
        "transcription_transcribe_audio_async",
        "transcription_transcribe_greedy",
        "transcription_translate",
        "verify_enrichment_tool",
        "verify_human_attested_tool",
        "verify_statute_external_fetch_tool",
        "verify_statute_in_bundle_tool",
        "write_violation_json_tool",
        "zip_bundle_tool",
        "mcp__mcp-server-files__read_text_file",
        "mcp__mcp-server-files__list_directory",
        "mcp__mcp-server-files__list_directory_recursive",
        "mcp__mcp-server-files__write_file",
        "mcp__mcp-server-files__create_directory",
        "mcp__mcp-server-files__delete_file",
        "mcp__mcp-server-files__move_file",
        "mcp__mcp-server-files__copy_file",
        "mcp__mcp-server-files__get_file_info",
        "mcp__mcp-server-files__search_files"
      ],
      "denied_tools": [],
      "require_confirmation_for": [],
      "notes": [
        "All 290 MCP tools from the ecosystem report (8 projects) pre-approved for Olivia Orchestrator",
        "Projects: transcription, juris-search, garge, violation-refiner, ocr, discovery, audio, ops-dashboard",
        "Tools sourced from ecosystem_report_latest.md generated 2026-08-02",
        "Added general MCP filesystem tools (mcp-server-files) to avoid permission denials during project work"
      ]
    }
  }
}